No.     Time           Source                Destination           Protocol Length Info
      1 0.000000       4000                  304                   Camel-v2 266    invoke initialDP 

Frame 1: 266 bytes on wire (2128 bits), 266 bytes captured (2128 bits)
Ethernet II, Src: Private_01:01:01 (01:01:01:01:01:01), Dst: MS-NLB-PhysServer-02_02:02:02:02 (02:02:02:02:02:02)
Internet Protocol Version 4, Src: 1.1.1.1, Dst: 2.2.2.2
Stream Control Transmission Protocol, Src Port: 2904 (2904), Dst Port: 2904 (2904)
MTP 2 User Adaptation Layer
Message Transfer Part Level 3
Signalling Connection Control Part
Transaction Capabilities Application Part
Camel-V2

No.     Time           Source                Destination           Protocol Length Info
      2 1.000000       304                   4000                  Camel-v2 290    invoke requestReportBCSMEvent invoke connect 

Frame 2: 290 bytes on wire (2320 bits), 290 bytes captured (2320 bits)
Ethernet II, Src: Private_01:01:01 (01:01:01:01:01:01), Dst: MS-NLB-PhysServer-02_02:02:02:02 (02:02:02:02:02:02)
Internet Protocol Version 4, Src: 1.1.1.1, Dst: 2.2.2.2
Stream Control Transmission Protocol, Src Port: 2904 (2904), Dst Port: 2904 (2904)
MTP 2 User Adaptation Layer
Message Transfer Part Level 3
Signalling Connection Control Part
Transaction Capabilities Application Part
Camel-V2
Camel-V2

No.     Time           Source                Destination           Protocol Length Info
      3 10.000000      4000                  304                   Camel    150    invoke eventReportBCSM 

Frame 3: 150 bytes on wire (1200 bits), 150 bytes captured (1200 bits)
Ethernet II, Src: Private_01:01:01 (01:01:01:01:01:01), Dst: MS-NLB-PhysServer-02_02:02:02:02 (02:02:02:02:02:02)
Internet Protocol Version 4, Src: 1.1.1.1, Dst: 2.2.2.2
Stream Control Transmission Protocol, Src Port: 2904 (2904), Dst Port: 2904 (2904)
MTP 2 User Adaptation Layer
Message Transfer Part Level 3
Signalling Connection Control Part
Transaction Capabilities Application Part
Camel

No.     Time           Source                Destination           Protocol Length Info
      4 10.000000      304                   4000                  Camel    130    invoke releaseCall 

Frame 4: 130 bytes on wire (1040 bits), 130 bytes captured (1040 bits)
Ethernet II, Src: Private_01:01:01 (01:01:01:01:01:01), Dst: MS-NLB-PhysServer-02_02:02:02:02 (02:02:02:02:02:02)
Internet Protocol Version 4, Src: 1.1.1.1, Dst: 2.2.2.2
Stream Control Transmission Protocol, Src Port: 2904 (2904), Dst Port: 2904 (2904)
MTP 2 User Adaptation Layer
Message Transfer Part Level 3
Signalling Connection Control Part
Transaction Capabilities Application Part
Camel

No.     Time           Source                Destination           Protocol Length Info
      5 0.000000       4000                  304                   Camel-v2 266    invoke initialDP 

Frame 5: 266 bytes on wire (2128 bits), 266 bytes captured (2128 bits)
Ethernet II, Src: Private_01:01:01 (01:01:01:01:01:01), Dst: MS-NLB-PhysServer-02_02:02:02:02 (02:02:02:02:02:02)
Internet Protocol Version 4, Src: 1.1.1.1, Dst: 2.2.2.2
Stream Control Transmission Protocol, Src Port: 2904 (2904), Dst Port: 2904 (2904)
MTP 2 User Adaptation Layer
Message Transfer Part Level 3
Signalling Connection Control Part
Transaction Capabilities Application Part
Camel-V2

No.     Time           Source                Destination           Protocol Length Info
      6 1.000000       304                   4000                  Camel-v2 290    invoke requestReportBCSMEvent invoke connect 

Frame 6: 290 bytes on wire (2320 bits), 290 bytes captured (2320 bits)
Ethernet II, Src: Private_01:01:01 (01:01:01:01:01:01), Dst: MS-NLB-PhysServer-02_02:02:02:02 (02:02:02:02:02:02)
Internet Protocol Version 4, Src: 1.1.1.1, Dst: 2.2.2.2
Stream Control Transmission Protocol, Src Port: 2904 (2904), Dst Port: 2904 (2904)
MTP 2 User Adaptation Layer
Message Transfer Part Level 3
Signalling Connection Control Part
Transaction Capabilities Application Part
Camel-V2
Camel-V2

No.     Time           Source                Destination           Protocol Length Info
      7 10.000000      4000                  304                   Camel    150    invoke eventReportBCSM 

Frame 7: 150 bytes on wire (1200 bits), 150 bytes captured (1200 bits)
Ethernet II, Src: Private_01:01:01 (01:01:01:01:01:01), Dst: MS-NLB-PhysServer-02_02:02:02:02 (02:02:02:02:02:02)
Internet Protocol Version 4, Src: 1.1.1.1, Dst: 2.2.2.2
Stream Control Transmission Protocol, Src Port: 2904 (2904), Dst Port: 2904 (2904)
MTP 2 User Adaptation Layer
Message Transfer Part Level 3
Signalling Connection Control Part
Transaction Capabilities Application Part
Camel

No.     Time           Source                Destination           Protocol Length Info
      8 10.000000      304                   4000                  Camel    130    invoke releaseCall 

Frame 8: 130 bytes on wire (1040 bits), 130 bytes captured (1040 bits)
Ethernet II, Src: Private_01:01:01 (01:01:01:01:01:01), Dst: MS-NLB-PhysServer-02_02:02:02:02 (02:02:02:02:02:02)
Internet Protocol Version 4, Src: 1.1.1.1, Dst: 2.2.2.2
Stream Control Transmission Protocol, Src Port: 2904 (2904), Dst Port: 2904 (2904)
MTP 2 User Adaptation Layer
Message Transfer Part Level 3
Signalling Connection Control Part
Transaction Capabilities Application Part
Camel

No.     Time           Source                Destination           Protocol Length Info
      9 -11715560.000000 ExtremeN_1f:a7:26     LLDP_Multicast        LLDP     64     Duplicate Time-To-Live TLV

Frame 9: 64 bytes on wire (512 bits), 64 bytes captured (512 bits)
Ethernet II, Src: ExtremeN_1f:a7:26 (00:04:96:1f:a7:26), Dst: LLDP_Multicast (01:80:c2:00:00:0e)
Link Layer Discovery Protocol

No.     Time           Source                Destination           Protocol Length Info
     10 -33083810.313053 10.1.1.2              65.54.179.198         SSLv2    189    Client Hello

Frame 10: 189 bytes on wire (1512 bits), 189 bytes captured (1512 bits)
Ethernet II, Src: SMCNetwo_22:5a:03 (00:04:e2:22:5a:03), Dst: D-Link_6f:d7:c1 (00:05:5d:6f:d7:c1)
Internet Protocol Version 4, Src: 10.1.1.2, Dst: 65.54.179.198
Transmission Control Protocol, Src Port: 32785, Dst Port: 443, Seq: 1, Ack: 1, Len: 123
Transport Layer Security

No.     Time           Source                Destination           Protocol Length Info
     11 -33083810.113054 65.54.179.198         10.1.1.2              SSLv3    1179   Server Hello, Certificate, Server Hello Done

Frame 11: 1179 bytes on wire (9432 bits), 1179 bytes captured (9432 bits)
Ethernet II, Src: D-Link_6f:d7:c1 (00:05:5d:6f:d7:c1), Dst: SMCNetwo_22:5a:03 (00:04:e2:22:5a:03)
Internet Protocol Version 4, Src: 65.54.179.198, Dst: 10.1.1.2
Transmission Control Protocol, Src Port: 443, Dst Port: 32785, Seq: 1, Ack: 124, Len: 1113
Transport Layer Security

No.     Time           Source                Destination           Protocol Length Info
     12 -33083810.103054 10.1.1.2              65.54.179.198         SSLv3    270    Client Key Exchange, Change Cipher Spec, Encrypted Handshake Message

Frame 12: 270 bytes on wire (2160 bits), 270 bytes captured (2160 bits)
Ethernet II, Src: SMCNetwo_22:5a:03 (00:04:e2:22:5a:03), Dst: D-Link_6f:d7:c1 (00:05:5d:6f:d7:c1)
Internet Protocol Version 4, Src: 10.1.1.2, Dst: 65.54.179.198
Transmission Control Protocol, Src Port: 32785, Dst Port: 443, Seq: 124, Ack: 1114, Len: 204
Transport Layer Security

No.     Time           Source                Destination           Protocol Length Info
     13 -33083809.903054 65.54.179.198         10.1.1.2              SSLv3    133    Change Cipher Spec, Encrypted Handshake Message

Frame 13: 133 bytes on wire (1064 bits), 133 bytes captured (1064 bits)
Ethernet II, Src: D-Link_6f:d7:c1 (00:05:5d:6f:d7:c1), Dst: SMCNetwo_22:5a:03 (00:04:e2:22:5a:03)
Internet Protocol Version 4, Src: 65.54.179.198, Dst: 10.1.1.2
Transmission Control Protocol, Src Port: 443, Dst Port: 32785, Seq: 1114, Ack: 328, Len: 67
Transport Layer Security

No.     Time           Source                Destination           Protocol Length Info
     14 -33083809.733053 10.1.1.2              65.54.179.198         SSLv3    724    Application Data

Frame 14: 724 bytes on wire (5792 bits), 724 bytes captured (5792 bits)
Ethernet II, Src: SMCNetwo_22:5a:03 (00:04:e2:22:5a:03), Dst: D-Link_6f:d7:c1 (00:05:5d:6f:d7:c1)
Internet Protocol Version 4, Src: 10.1.1.2, Dst: 65.54.179.198
Transmission Control Protocol, Src Port: 32785, Dst Port: 443, Seq: 328, Ack: 1181, Len: 658
Transport Layer Security

No.     Time           Source                Destination           Protocol Length Info
     15 -33083809.733053 10.1.1.2              65.54.179.198         SSLv3    109    Application Data

Frame 15: 109 bytes on wire (872 bits), 109 bytes captured (872 bits)
Ethernet II, Src: SMCNetwo_22:5a:03 (00:04:e2:22:5a:03), Dst: D-Link_6f:d7:c1 (00:05:5d:6f:d7:c1)
Internet Protocol Version 4, Src: 10.1.1.2, Dst: 65.54.179.198
Transmission Control Protocol, Src Port: 32785, Dst Port: 443, Seq: 986, Ack: 1181, Len: 43
Transport Layer Security

No.     Time           Source                Destination           Protocol Length Info
     16 -33083809.503053 10.1.1.2              65.54.179.198         SSLv3    159    Application Data

Frame 16: 159 bytes on wire (1272 bits), 159 bytes captured (1272 bits)
Ethernet II, Src: SMCNetwo_22:5a:03 (00:04:e2:22:5a:03), Dst: D-Link_6f:d7:c1 (00:05:5d:6f:d7:c1)
Internet Protocol Version 4, Src: 10.1.1.2, Dst: 65.54.179.198
Transmission Control Protocol, Src Port: 32785, Dst Port: 443, Seq: 1029, Ack: 1181, Len: 93
Transport Layer Security

No.     Time           Source                Destination           Protocol Length Info
     17 -33083809.493053 65.54.179.198         10.1.1.2              SSLv3    112    Application Data

Frame 17: 112 bytes on wire (896 bits), 112 bytes captured (896 bits)
Ethernet II, Src: D-Link_6f:d7:c1 (00:05:5d:6f:d7:c1), Dst: SMCNetwo_22:5a:03 (00:04:e2:22:5a:03)
Internet Protocol Version 4, Src: 65.54.179.198, Dst: 10.1.1.2
Transmission Control Protocol, Src Port: 443, Dst Port: 32785, Seq: 1181, Ack: 1029, Len: 46
Transport Layer Security

No.     Time           Source                Destination           Protocol Length Info
     18 -33083809.303053 65.54.179.198         10.1.1.2              SSLv3    776    Application Data

Frame 18: 776 bytes on wire (6208 bits), 776 bytes captured (6208 bits)
Ethernet II, Src: D-Link_6f:d7:c1 (00:05:5d:6f:d7:c1), Dst: SMCNetwo_22:5a:03 (00:04:e2:22:5a:03)
Internet Protocol Version 4, Src: 65.54.179.198, Dst: 10.1.1.2
Transmission Control Protocol, Src Port: 443, Dst Port: 32785, Seq: 1227, Ack: 1122, Len: 710
Transport Layer Security

No.     Time           Source                Destination           Protocol Length Info
     19 -33083809.103054 10.1.1.2              65.54.183.192         SSLv2    189    Client Hello

Frame 19: 189 bytes on wire (1512 bits), 189 bytes captured (1512 bits)
Ethernet II, Src: SMCNetwo_22:5a:03 (00:04:e2:22:5a:03), Dst: D-Link_6f:d7:c1 (00:05:5d:6f:d7:c1)
Internet Protocol Version 4, Src: 10.1.1.2, Dst: 65.54.183.192
Transmission Control Protocol, Src Port: 32786, Dst Port: 443, Seq: 1, Ack: 1, Len: 123
Transport Layer Security

No.     Time           Source                Destination           Protocol Length Info
     20 -33083808.903054 65.54.183.192         10.1.1.2              SSLv3    1182   Server Hello, Certificate, Server Hello Done

Frame 20: 1182 bytes on wire (9456 bits), 1182 bytes captured (9456 bits)
Ethernet II, Src: D-Link_6f:d7:c1 (00:05:5d:6f:d7:c1), Dst: SMCNetwo_22:5a:03 (00:04:e2:22:5a:03)
Internet Protocol Version 4, Src: 65.54.183.192, Dst: 10.1.1.2
Transmission Control Protocol, Src Port: 443, Dst Port: 32786, Seq: 1, Ack: 124, Len: 1116
Transport Layer Security

No.     Time           Source                Destination           Protocol Length Info
     21 -33083808.873054 10.1.1.2              65.54.183.192         SSLv3    270    Client Key Exchange, Change Cipher Spec, Encrypted Handshake Message

Frame 21: 270 bytes on wire (2160 bits), 270 bytes captured (2160 bits)
Ethernet II, Src: SMCNetwo_22:5a:03 (00:04:e2:22:5a:03), Dst: D-Link_6f:d7:c1 (00:05:5d:6f:d7:c1)
Internet Protocol Version 4, Src: 10.1.1.2, Dst: 65.54.183.192
Transmission Control Protocol, Src Port: 32786, Dst Port: 443, Seq: 124, Ack: 1117, Len: 204
Transport Layer Security

No.     Time           Source                Destination           Protocol Length Info
     22 -33083808.683054 65.54.183.192         10.1.1.2              SSLv3    133    Change Cipher Spec, Encrypted Handshake Message

Frame 22: 133 bytes on wire (1064 bits), 133 bytes captured (1064 bits)
Ethernet II, Src: D-Link_6f:d7:c1 (00:05:5d:6f:d7:c1), Dst: SMCNetwo_22:5a:03 (00:04:e2:22:5a:03)
Internet Protocol Version 4, Src: 65.54.183.192, Dst: 10.1.1.2
Transmission Control Protocol, Src Port: 443, Dst Port: 32786, Seq: 1117, Ack: 328, Len: 67
Transport Layer Security

No.     Time           Source                Destination           Protocol Length Info
     23 -33083808.643054 10.1.1.2              65.54.183.192         SSLv3    891    Application Data

Frame 23: 891 bytes on wire (7128 bits), 891 bytes captured (7128 bits)
Ethernet II, Src: SMCNetwo_22:5a:03 (00:04:e2:22:5a:03), Dst: D-Link_6f:d7:c1 (00:05:5d:6f:d7:c1)
Internet Protocol Version 4, Src: 10.1.1.2, Dst: 65.54.183.192
Transmission Control Protocol, Src Port: 32786, Dst Port: 443, Seq: 328, Ack: 1184, Len: 825
Transport Layer Security

No.     Time           Source                Destination           Protocol Length Info
     24 -33083808.383054 65.54.183.192         10.1.1.2              SSLv3    508    Application Data

Frame 24: 508 bytes on wire (4064 bits), 508 bytes captured (4064 bits)
Ethernet II, Src: D-Link_6f:d7:c1 (00:05:5d:6f:d7:c1), Dst: SMCNetwo_22:5a:03 (00:04:e2:22:5a:03)
Internet Protocol Version 4, Src: 65.54.183.192, Dst: 10.1.1.2
Transmission Control Protocol, Src Port: 443, Dst Port: 32786, Seq: 1184, Ack: 1153, Len: 442
Transport Layer Security

No.     Time           Source                Destination           Protocol Length Info
     25 -33083808.373054 65.54.183.192         10.1.1.2              SSLv3    501    Application Data

Frame 25: 501 bytes on wire (4008 bits), 501 bytes captured (4008 bits)
Ethernet II, Src: D-Link_6f:d7:c1 (00:05:5d:6f:d7:c1), Dst: SMCNetwo_22:5a:03 (00:04:e2:22:5a:03)
Internet Protocol Version 4, Src: 65.54.183.192, Dst: 10.1.1.2
Transmission Control Protocol, Src Port: 443, Dst Port: 32786, Seq: 1626, Ack: 1153, Len: 435
Transport Layer Security

No.     Time           Source                Destination           Protocol Length Info
     26 -33083807.843054 10.1.1.2              65.54.183.192         SSLv2    189    Client Hello

Frame 26: 189 bytes on wire (1512 bits), 189 bytes captured (1512 bits)
Ethernet II, Src: SMCNetwo_22:5a:03 (00:04:e2:22:5a:03), Dst: D-Link_6f:d7:c1 (00:05:5d:6f:d7:c1)
Internet Protocol Version 4, Src: 10.1.1.2, Dst: 65.54.183.192
Transmission Control Protocol, Src Port: 32787, Dst Port: 443, Seq: 1, Ack: 1, Len: 123
Transport Layer Security

No.     Time           Source                Destination           Protocol Length Info
     27 -33083807.643054 65.54.183.192         10.1.1.2              SSLv3    1182   Server Hello, Certificate, Server Hello Done

Frame 27: 1182 bytes on wire (9456 bits), 1182 bytes captured (9456 bits)
Ethernet II, Src: D-Link_6f:d7:c1 (00:05:5d:6f:d7:c1), Dst: SMCNetwo_22:5a:03 (00:04:e2:22:5a:03)
Internet Protocol Version 4, Src: 65.54.183.192, Dst: 10.1.1.2
Transmission Control Protocol, Src Port: 443, Dst Port: 32787, Seq: 1, Ack: 124, Len: 1116
Transport Layer Security

No.     Time           Source                Destination           Protocol Length Info
     28 -33083807.633054 10.1.1.2              65.54.183.192         SSLv3    270    Client Key Exchange, Change Cipher Spec, Encrypted Handshake Message

Frame 28: 270 bytes on wire (2160 bits), 270 bytes captured (2160 bits)
Ethernet II, Src: SMCNetwo_22:5a:03 (00:04:e2:22:5a:03), Dst: D-Link_6f:d7:c1 (00:05:5d:6f:d7:c1)
Internet Protocol Version 4, Src: 10.1.1.2, Dst: 65.54.183.192
Transmission Control Protocol, Src Port: 32787, Dst Port: 443, Seq: 124, Ack: 1117, Len: 204
Transport Layer Security

No.     Time           Source                Destination           Protocol Length Info
     29 -33083807.443054 65.54.183.192         10.1.1.2              SSLv3    133    Change Cipher Spec, Encrypted Handshake Message

Frame 29: 133 bytes on wire (1064 bits), 133 bytes captured (1064 bits)
Ethernet II, Src: D-Link_6f:d7:c1 (00:05:5d:6f:d7:c1), Dst: SMCNetwo_22:5a:03 (00:04:e2:22:5a:03)
Internet Protocol Version 4, Src: 65.54.183.192, Dst: 10.1.1.2
Transmission Control Protocol, Src Port: 443, Dst Port: 32787, Seq: 1117, Ack: 328, Len: 67
Transport Layer Security

No.     Time           Source                Destination           Protocol Length Info
     30 -33083807.393054 10.1.1.2              65.54.183.192         SSLv3    560    Application Data

Frame 30: 560 bytes on wire (4480 bits), 560 bytes captured (4480 bits)
Ethernet II, Src: SMCNetwo_22:5a:03 (00:04:e2:22:5a:03), Dst: D-Link_6f:d7:c1 (00:05:5d:6f:d7:c1)
Internet Protocol Version 4, Src: 10.1.1.2, Dst: 65.54.183.192
Transmission Control Protocol, Src Port: 32787, Dst Port: 443, Seq: 328, Ack: 1184, Len: 494
Transport Layer Security

No.     Time           Source                Destination           Protocol Length Info
     31 -33083807.183054 65.54.183.192         10.1.1.2              SSLv3    709    [TCP Previous segment not captured] , Continuation Data

Frame 31: 709 bytes on wire (5672 bits), 709 bytes captured (5672 bits)
Ethernet II, Src: D-Link_6f:d7:c1 (00:05:5d:6f:d7:c1), Dst: SMCNetwo_22:5a:03 (00:04:e2:22:5a:03)
Internet Protocol Version 4, Src: 65.54.183.192, Dst: 10.1.1.2
Transmission Control Protocol, Src Port: 443, Dst Port: 32787, Seq: 2632, Ack: 822, Len: 643
Transport Layer Security

No.     Time           Source                Destination           Protocol Length Info
     32 -33083807.163054 65.54.183.192         10.1.1.2              IPv4     778    Fragmented IP protocol (proto=TCP 6, off=0, ID=0001)

Frame 32: 778 bytes on wire (6224 bits), 778 bytes captured (6224 bits)
Ethernet II, Src: D-Link_6f:d7:c1 (00:05:5d:6f:d7:c1), Dst: SMCNetwo_22:5a:03 (00:04:e2:22:5a:03)
Internet Protocol Version 4, Src: 65.54.183.192, Dst: 10.1.1.2
Data (744 bytes)

0000  01 bb 80 13 ea cc d2 ee 58 d2 0f f1 80 10 41 3b   ........X.....A;
0010  ee 9a 00 00 01 01 08 0a 00 90 4d c0 00 00 e3 31   ..........M....1
0020  17 03 00 08 26 52 7a 31 c1 15 ec d6 d1 54 59 63   ....&Rz1.....TYc
0030  92 df 4b c3 a3 75 fb 0c 17 27 0a 0b bc c4 31 2b   ..K..u...'....1+
0040  15 39 88 52 17 0b 21 38 b7 27 27 fb c8 e2 b4 ef   .9.R..!8.''.....
0050  4f 7b ad 49 f8 58 f5 dc 5f 3f 09 66 ac a1 e6 06   O{.I.X.._?.f....
0060  8c 9d 20 14 56 99 23 8e 34 b0 e6 b8 fc ae fa 14   .. .V.#.4.......
0070  df 98 3d a9 63 0d c3 8b 8c 5e 53 b2 91 b2 c1 1e   ..=.c....^S.....
0080  28 d0 71 89 f2 6b c3 b0 7b 77 c8 4c 61 93 0f 84   (.q..k..{w.La...
0090  8f 87 ab ac 01 81 85 f2 e9 ff 7f 56 5b 5c 70 a3   ...........V[\p.
00a0  cc 00 39 38 f8 f8 03 94 87 63 28 81 05 f9 ef 37   ..98.....c(....7
00b0  c9 dd 3b cc 15 94 6e ef 34 33 40 ad 88 b6 48 bc   ..;...n.43@...H.
00c0  8f 31 3a 60 bd a1 c1 d5 39 dd da 8b 2c 19 ec e4   .1:`....9...,...
00d0  cd 01 43 8c 4c fd a3 14 f9 8f 9f c1 3e 2b 2e c4   ..C.L.......>+..
00e0  37 ba 9a 91 b6 6a f5 f6 12 af 3b 7f fb d8 4e 51   7....j....;...NQ
00f0  51 03 1f 4f 69 c1 6d 88 5f bd c7 e2 bf 48 29 35   Q..Oi.m._....H)5
0100  d0 bd 63 18 16 20 02 39 18 7f 83 6c f0 29 c1 a8   ..c.. .9...l.)..
0110  a8 4d c4 9a 32 5c 75 5a 2d 40 80 65 e6 c0 37 d9   .M..2\uZ-@.e..7.
0120  52 84 63 ab 93 05 7c 2b ec cd 71 59 d5 11 76 60   R.c...|+..qY..v`
0130  f4 70 d0 eb 95 8f 48 1f 79 57 75 ff 63 89 bd cc   .p....H.yWu.c...
0140  25 ba 79 ff 0c 53 00 b9 cd 1b 4f 5b 11 2a 03 c7   %.y..S....O[.*..
0150  a2 fd d2 d7 37 43 dd cd 26 84 71 0c 5e a2 d0 ff   ....7C..&.q.^...
0160  45 fa 50 e7 71 a2 e5 f7 35 21 a5 f0 fd 62 a8 6c   E.P.q...5!...b.l
0170  f4 f2 a5 38 57 ae eb 0d 93 27 ab c5 b1 ca 42 85   ...8W....'....B.
0180  e9 17 8b 3f 68 24 3b 53 96 47 00 a7 ca f0 32 e8   ...?h$;S.G....2.
0190  5b ef 4e 17 af 2c 59 4d 44 a7 46 b7 4f e9 c8 82   [.N..,YMD.F.O...
01a0  2d 6b be 69 b7 bf 6e 5e a7 d9 ee fd b3 3c 30 5c   -k.i..n^.....<0\
01b0  3c 54 ac d0 40 cf 35 74 30 c3 2b b8 a0 29 e3 d1   <T..@.5t0.+..)..
01c0  23 2b bb 96 a0 21 19 e2 23 07 69 26 48 7e 33 8e   #+...!..#.i&H~3.
01d0  a9 c5 1a aa c0 ba ca 68 70 66 4c 40 70 9e 21 f5   .......hpfL@p.!.
01e0  be c8 6e 20 b2 56 9e 42 9e 1b ab 3d 4a 55 40 56   ..n .V.B...=JU@V
01f0  61 cf 22 e6 80 2f 36 59 6e 2d b9 c0 2d 36 da 05   a."../6Yn-..-6..
0200  8f 9c bc c9 88 3d b2 c2 3b dc af 4c 48 ad ae 5d   .....=..;..LH..]
0210  19 c9 27 d6 e6 dc ef 66 00 16 03 d2 92 51 52 f4   ..'....f.....QR.
0220  3d 81 49 fb ad d8 bc f2 23 46 7c 95 21 47 61 b2   =.I.....#F|.!Ga.
0230  f1 99 f8 cb 1a 13 bf 72 b1 3c 18 6f 0c 5c 4a 79   .......r.<.o.\Jy
0240  8a 4f 91 21 e4 fc a5 07 ad da 77 c7 76 6d 5e 44   .O.!......w.vm^D
0250  e4 ad 5f 4a 69 60 4b 38 6d 7f 29 3c dd 0f 9b ef   .._Ji`K8m.)<....
0260  77 4b 48 a8 d3 ae 6c d1 d1 ef 40 15 50 ef 74 ca   wKH...l...@.P.t.
0270  e2 89 22 65 98 ec 32 7b 63 6b 65 b7 17 85 69 79   .."e..2{cke...iy
0280  9c 40 27 f2 52 a2 b7 41 15 90 42 55 05 21 15 d7   .@'.R..A..BU.!..
0290  ca 0f ec de 82 8b 9d 3a c7 0d 61 ef d3 24 c8 0d   .......:..a..$..
02a0  49 20 6f 19 88 70 55 38 7d 1b 40 d6 f2 bc 7f 99   I o..pU8}.@.....
02b0  c1 1f 15 4e 51 f7 05 37 24 5c 3c e7 2f 8e 5b 0d   ...NQ..7$\<./.[.
02c0  08 07 eb eb 1b 9e 3d be c3 e7 ac 8b d6 ed 2d 62   ......=.......-b
02d0  6c 90 99 b2 e2 e3 e6 27 4c fb 5f f2 68 82 fe 01   l......'L._.h...
02e0  72 2a cb 13 7a 72 62 9e                           r*..zrb.

No.     Time           Source                Destination           Protocol Length Info
     33 259945210.257808 10.0.75.166           67.205.74.184         TCP      70     59238 → 5060 [PSH, ACK] Seq=1 Ack=1 Win=331 Len=4 TSval=2668255 TSecr=679933653

Frame 33: 70 bytes on wire (560 bits), 70 bytes captured (560 bits)
Ethernet II, Src: ASUSTekC_d0:55:d4 (14:da:e9:d0:55:d4), Dst: Dell_f7:b1:d2 (00:19:b9:f7:b1:d2)
Internet Protocol Version 4, Src: 10.0.75.166, Dst: 67.205.74.184
Transmission Control Protocol, Src Port: 59238, Dst Port: 5060, Seq: 1, Ack: 1, Len: 4

No.     Time           Source                Destination           Protocol Length Info
     34 259945210.305238 67.205.74.184         10.0.75.166           TCP      66     5060 → 59238 [ACK] Seq=1 Ack=5 Win=501 Len=0 TSval=679946754 TSecr=2668255

Frame 34: 66 bytes on wire (528 bits), 66 bytes captured (528 bits)
Ethernet II, Src: Dell_f7:b1:d2 (00:19:b9:f7:b1:d2), Dst: ASUSTekC_d0:55:d4 (14:da:e9:d0:55:d4)
Internet Protocol Version 4, Src: 67.205.74.184, Dst: 10.0.75.166
Transmission Control Protocol, Src Port: 5060, Dst Port: 59238, Seq: 1, Ack: 5, Len: 0

No.     Time           Source                Destination           Protocol Length Info
     35 259945228.673938 10.0.75.166           67.205.74.184         SIP/SDP  988    Request: INVITE sip:5145551337@montreal.voip.ms;transport=TCP | 

Frame 35: 988 bytes on wire (7904 bits), 988 bytes captured (7904 bits)
Ethernet II, Src: ASUSTekC_d0:55:d4 (14:da:e9:d0:55:d4), Dst: Dell_f7:b1:d2 (00:19:b9:f7:b1:d2)
Internet Protocol Version 4, Src: 10.0.75.166, Dst: 67.205.74.184
Transmission Control Protocol, Src Port: 59238, Dst Port: 5060, Seq: 5, Ack: 1, Len: 922
Session Initiation Protocol (INVITE)

No.     Time           Source                Destination           Protocol Length Info
     36 259945228.673964 10.0.75.166           67.205.74.184         SIP/XML  1514   Request: PUBLISH sip:133700@montreal.voip.ms;transport=TCP | 

Frame 36: 1514 bytes on wire (12112 bits), 1514 bytes captured (12112 bits)
Ethernet II, Src: ASUSTekC_d0:55:d4 (14:da:e9:d0:55:d4), Dst: Dell_f7:b1:d2 (00:19:b9:f7:b1:d2)
Internet Protocol Version 4, Src: 10.0.75.166, Dst: 67.205.74.184
Transmission Control Protocol, Src Port: 59238, Dst Port: 5060, Seq: 927, Ack: 1, Len: 1448
Session Initiation Protocol (PUBLISH)

No.     Time           Source                Destination           Protocol Length Info
     37 259945228.689835 67.205.74.184         10.0.75.166           TCP      66     5060 → 59238 [ACK] Seq=1 Ack=927 Win=499 Len=0 TSval=679965139 TSecr=2672859

Frame 37: 66 bytes on wire (528 bits), 66 bytes captured (528 bits)
Ethernet II, Src: Dell_f7:b1:d2 (00:19:b9:f7:b1:d2), Dst: ASUSTekC_d0:55:d4 (14:da:e9:d0:55:d4)
Internet Protocol Version 4, Src: 67.205.74.184, Dst: 10.0.75.166
Transmission Control Protocol, Src Port: 5060, Dst Port: 59238, Seq: 1, Ack: 927, Len: 0

No.     Time           Source                Destination           Protocol Length Info
     38 259945228.689852 10.0.75.166           67.205.74.184         SIP      331    Request: SUBSCRIBE sip:133700@montreal.voip.ms;transport=TCP | 

Frame 38: 331 bytes on wire (2648 bits), 331 bytes captured (2648 bits)
Ethernet II, Src: ASUSTekC_d0:55:d4 (14:da:e9:d0:55:d4), Dst: Dell_f7:b1:d2 (00:19:b9:f7:b1:d2)
Internet Protocol Version 4, Src: 10.0.75.166, Dst: 67.205.74.184
Transmission Control Protocol, Src Port: 59238, Dst Port: 5060, Seq: 2375, Ack: 1, Len: 265
[2 Reassembled TCP Segments (724 bytes): #36(459), #38(265)]
Session Initiation Protocol (SUBSCRIBE)

No.     Time           Source                Destination           Protocol Length Info
     39 259945228.690758 67.205.74.184         10.0.75.166           SIP      650    Status: 401 Unauthorized | 

Frame 39: 650 bytes on wire (5200 bits), 650 bytes captured (5200 bits)
Ethernet II, Src: Dell_f7:b1:d2 (00:19:b9:f7:b1:d2), Dst: ASUSTekC_d0:55:d4 (14:da:e9:d0:55:d4)
Internet Protocol Version 4, Src: 67.205.74.184, Dst: 10.0.75.166
Transmission Control Protocol, Src Port: 5060, Dst Port: 59238, Seq: 1, Ack: 927, Len: 584
Session Initiation Protocol (401)

No.     Time           Source                Destination           Protocol Length Info
     40 259945228.690768 10.0.75.166           67.205.74.184         TCP      66     59238 → 5060 [ACK] Seq=2640 Ack=585 Win=331 Len=0 TSval=2672863 TSecr=679965139

Frame 40: 66 bytes on wire (528 bits), 66 bytes captured (528 bits)
Ethernet II, Src: ASUSTekC_d0:55:d4 (14:da:e9:d0:55:d4), Dst: Dell_f7:b1:d2 (00:19:b9:f7:b1:d2)
Internet Protocol Version 4, Src: 10.0.75.166, Dst: 67.205.74.184
Transmission Control Protocol, Src Port: 59238, Dst Port: 5060, Seq: 2640, Ack: 585, Len: 0

No.     Time           Source                Destination           Protocol Length Info
     41 259945228.691220 10.0.75.166           67.205.74.184         SIP      1514   Request: ACK sip:5145551337@montreal.voip.ms;transport=TCP | 

Frame 41: 1514 bytes on wire (12112 bits), 1514 bytes captured (12112 bits)
Ethernet II, Src: ASUSTekC_d0:55:d4 (14:da:e9:d0:55:d4), Dst: Dell_f7:b1:d2 (00:19:b9:f7:b1:d2)
Internet Protocol Version 4, Src: 10.0.75.166, Dst: 67.205.74.184
Transmission Control Protocol, Src Port: 59238, Dst Port: 5060, Seq: 2640, Ack: 585, Len: 1448
Session Initiation Protocol (ACK)

No.     Time           Source                Destination           Protocol Length Info
     42 259945228.699781 67.205.74.184         10.0.75.166           TCP      66     5060 → 59238 [ACK] Seq=585 Ack=2640 Win=501 Len=0 TSval=679965149 TSecr=2672859

Frame 42: 66 bytes on wire (528 bits), 66 bytes captured (528 bits)
Ethernet II, Src: Dell_f7:b1:d2 (00:19:b9:f7:b1:d2), Dst: ASUSTekC_d0:55:d4 (14:da:e9:d0:55:d4)
Internet Protocol Version 4, Src: 67.205.74.184, Dst: 10.0.75.166
Transmission Control Protocol, Src Port: 5060, Dst Port: 59238, Seq: 585, Ack: 2640, Len: 0

No.     Time           Source                Destination           Protocol Length Info
     43 259945228.699803 10.0.75.166           67.205.74.184         SIP/SDP  118    Request: INVITE sip:5145551337@montreal.voip.ms;transport=TCP | 

Frame 43: 118 bytes on wire (944 bits), 118 bytes captured (944 bits)
Ethernet II, Src: ASUSTekC_d0:55:d4 (14:da:e9:d0:55:d4), Dst: Dell_f7:b1:d2 (00:19:b9:f7:b1:d2)
Internet Protocol Version 4, Src: 10.0.75.166, Dst: 67.205.74.184
Transmission Control Protocol, Src Port: 59238, Dst Port: 5060, Seq: 4088, Ack: 585, Len: 52
[2 Reassembled TCP Segments (1115 bytes): #41(1063), #43(52)]
Session Initiation Protocol (INVITE)

No.     Time           Source                Destination           Protocol Length Info
     44 259945228.701278 67.205.74.184         10.0.75.166           SIP      560    Status: 489 Bad Event | 

Frame 44: 560 bytes on wire (4480 bits), 560 bytes captured (4480 bits)
Ethernet II, Src: Dell_f7:b1:d2 (00:19:b9:f7:b1:d2), Dst: ASUSTekC_d0:55:d4 (14:da:e9:d0:55:d4)
Internet Protocol Version 4, Src: 67.205.74.184, Dst: 10.0.75.166
Transmission Control Protocol, Src Port: 5060, Dst Port: 59238, Seq: 585, Ack: 2640, Len: 494
Session Initiation Protocol (489)

No.     Time           Source                Destination           Protocol Length Info
     45 259945228.711229 67.205.74.184         10.0.75.166           TCP      66     5060 → 59238 [ACK] Seq=1079 Ack=4140 Win=501 Len=0 TSval=679965160 TSecr=2672863

Frame 45: 66 bytes on wire (528 bits), 66 bytes captured (528 bits)
Ethernet II, Src: Dell_f7:b1:d2 (00:19:b9:f7:b1:d2), Dst: ASUSTekC_d0:55:d4 (14:da:e9:d0:55:d4)
Internet Protocol Version 4, Src: 67.205.74.184, Dst: 10.0.75.166
Transmission Control Protocol, Src Port: 5060, Dst Port: 59238, Seq: 1079, Ack: 4140, Len: 0

No.     Time           Source                Destination           Protocol Length Info
     46 259945228.737521 10.0.75.166           67.205.74.184         TCP      66     59238 → 5060 [ACK] Seq=4140 Ack=1079 Win=331 Len=0 TSval=2672875 TSecr=679965149

Frame 46: 66 bytes on wire (528 bits), 66 bytes captured (528 bits)
Ethernet II, Src: ASUSTekC_d0:55:d4 (14:da:e9:d0:55:d4), Dst: Dell_f7:b1:d2 (00:19:b9:f7:b1:d2)
Internet Protocol Version 4, Src: 10.0.75.166, Dst: 67.205.74.184
Transmission Control Protocol, Src Port: 59238, Dst Port: 5060, Seq: 4140, Ack: 1079, Len: 0

No.     Time           Source                Destination           Protocol Length Info
     47 259945228.743614 67.205.74.184         10.0.75.166           SIP      1188   Status: 401 Unauthorized | Status: 100 Trying | 

Frame 47: 1188 bytes on wire (9504 bits), 1188 bytes captured (9504 bits)
Ethernet II, Src: Dell_f7:b1:d2 (00:19:b9:f7:b1:d2), Dst: ASUSTekC_d0:55:d4 (14:da:e9:d0:55:d4)
Internet Protocol Version 4, Src: 67.205.74.184, Dst: 10.0.75.166
Transmission Control Protocol, Src Port: 5060, Dst Port: 59238, Seq: 1079, Ack: 4140, Len: 1122
Session Initiation Protocol (401)
Session Initiation Protocol (100)

No.     Time           Source                Destination           Protocol Length Info
     48 259945228.743633 10.0.75.166           67.205.74.184         TCP      66     59238 → 5060 [ACK] Seq=4140 Ack=2201 Win=331 Len=0 TSval=2672876 TSecr=679965192

Frame 48: 66 bytes on wire (528 bits), 66 bytes captured (528 bits)
Ethernet II, Src: ASUSTekC_d0:55:d4 (14:da:e9:d0:55:d4), Dst: Dell_f7:b1:d2 (00:19:b9:f7:b1:d2)
Internet Protocol Version 4, Src: 10.0.75.166, Dst: 67.205.74.184
Transmission Control Protocol, Src Port: 59238, Dst Port: 5060, Seq: 4140, Ack: 2201, Len: 0

No.     Time           Source                Destination           Protocol Length Info
     49 259945228.744139 10.0.75.166           67.205.74.184         SIP      979    Request: SUBSCRIBE sip:133700@montreal.voip.ms;transport=TCP | 

Frame 49: 979 bytes on wire (7832 bits), 979 bytes captured (7832 bits)
Ethernet II, Src: ASUSTekC_d0:55:d4 (14:da:e9:d0:55:d4), Dst: Dell_f7:b1:d2 (00:19:b9:f7:b1:d2)
Internet Protocol Version 4, Src: 10.0.75.166, Dst: 67.205.74.184
Transmission Control Protocol, Src Port: 59238, Dst Port: 5060, Seq: 4140, Ack: 2201, Len: 913
Session Initiation Protocol (SUBSCRIBE)

No.     Time           Source                Destination           Protocol Length Info
     50 259945228.759912 67.205.74.184         10.0.75.166           SIP      562    Status: 404 Not Found | 

Frame 50: 562 bytes on wire (4496 bits), 562 bytes captured (4496 bits)
Ethernet II, Src: Dell_f7:b1:d2 (00:19:b9:f7:b1:d2), Dst: ASUSTekC_d0:55:d4 (14:da:e9:d0:55:d4)
Internet Protocol Version 4, Src: 67.205.74.184, Dst: 10.0.75.166
Transmission Control Protocol, Src Port: 5060, Dst Port: 59238, Seq: 2201, Ack: 5053, Len: 496
Session Initiation Protocol (404)

No.     Time           Source                Destination           Protocol Length Info
     51 259945228.797527 10.0.75.166           67.205.74.184         TCP      66     59238 → 5060 [ACK] Seq=5053 Ack=2697 Win=331 Len=0 TSval=2672890 TSecr=679965207

Frame 51: 66 bytes on wire (528 bits), 66 bytes captured (528 bits)
Ethernet II, Src: ASUSTekC_d0:55:d4 (14:da:e9:d0:55:d4), Dst: Dell_f7:b1:d2 (00:19:b9:f7:b1:d2)
Internet Protocol Version 4, Src: 10.0.75.166, Dst: 67.205.74.184
Transmission Control Protocol, Src Port: 59238, Dst Port: 5060, Seq: 5053, Ack: 2697, Len: 0

No.     Time           Source                Destination           Protocol Length Info
     52 259945234.621260 67.205.74.184         10.0.75.166           SIP/SDP  915    Status: 183 Session Progress | 

Frame 52: 915 bytes on wire (7320 bits), 915 bytes captured (7320 bits)
Ethernet II, Src: Dell_f7:b1:d2 (00:19:b9:f7:b1:d2), Dst: ASUSTekC_d0:55:d4 (14:da:e9:d0:55:d4)
Internet Protocol Version 4, Src: 67.205.74.184, Dst: 10.0.75.166
Transmission Control Protocol, Src Port: 5060, Dst Port: 59238, Seq: 2697, Ack: 5053, Len: 849
Session Initiation Protocol (183)

No.     Time           Source                Destination           Protocol Length Info
     53 259945234.621283 10.0.75.166           67.205.74.184         TCP      66     59238 → 5060 [ACK] Seq=5053 Ack=3546 Win=331 Len=0 TSval=2674345 TSecr=679971070

Frame 53: 66 bytes on wire (528 bits), 66 bytes captured (528 bits)
Ethernet II, Src: ASUSTekC_d0:55:d4 (14:da:e9:d0:55:d4), Dst: Dell_f7:b1:d2 (00:19:b9:f7:b1:d2)
Internet Protocol Version 4, Src: 10.0.75.166, Dst: 67.205.74.184
Transmission Control Protocol, Src Port: 59238, Dst Port: 5060, Seq: 5053, Ack: 3546, Len: 0

No.     Time           Source                Destination           Protocol Length Info
     54 259945234.644262 10.0.75.166           67.205.74.184         RTP      214    PT=ITU-T G.711 PCMU, SSRC=0xB76FC6F8, Seq=44557, Time=3029966523, Mark

Frame 54: 214 bytes on wire (1712 bits), 214 bytes captured (1712 bits)
Ethernet II, Src: ASUSTekC_d0:55:d4 (14:da:e9:d0:55:d4), Dst: Dell_f7:b1:d2 (00:19:b9:f7:b1:d2)
Internet Protocol Version 4, Src: 10.0.75.166, Dst: 67.205.74.184
User Datagram Protocol, Src Port: 8000, Dst Port: 12760
Real-Time Transport Protocol

No.     Time           Source                Destination           Protocol Length Info
     55 259945234.665889 67.205.74.184         10.0.75.166           RTP      214    PT=ITU-T G.711 PCMU, SSRC=0x389B1E59, Seq=27419, Time=3207838608

Frame 55: 214 bytes on wire (1712 bits), 214 bytes captured (1712 bits)
Ethernet II, Src: Dell_f7:b1:d2 (00:19:b9:f7:b1:d2), Dst: ASUSTekC_d0:55:d4 (14:da:e9:d0:55:d4)
Internet Protocol Version 4, Src: 67.205.74.184, Dst: 10.0.75.166
User Datagram Protocol, Src Port: 12760, Dst Port: 8000
Real-Time Transport Protocol

No.     Time           Source                Destination           Protocol Length Info
     56 259945234.667576 10.0.75.166           67.205.74.184         RTP      214    PT=ITU-T G.711 PCMU, SSRC=0xB76FC6F8, Seq=44558, Time=3029966683

Frame 56: 214 bytes on wire (1712 bits), 214 bytes captured (1712 bits)
Ethernet II, Src: ASUSTekC_d0:55:d4 (14:da:e9:d0:55:d4), Dst: Dell_f7:b1:d2 (00:19:b9:f7:b1:d2)
Internet Protocol Version 4, Src: 10.0.75.166, Dst: 67.205.74.184
User Datagram Protocol, Src Port: 8000, Dst Port: 12760
Real-Time Transport Protocol

No.     Time           Source                Destination           Protocol Length Info
     57 259945234.685827 67.205.74.184         10.0.75.166           RTP      214    PT=ITU-T G.711 PCMU, SSRC=0x389B1E59, Seq=27420, Time=3207838768

Frame 57: 214 bytes on wire (1712 bits), 214 bytes captured (1712 bits)
Ethernet II, Src: Dell_f7:b1:d2 (00:19:b9:f7:b1:d2), Dst: ASUSTekC_d0:55:d4 (14:da:e9:d0:55:d4)
Internet Protocol Version 4, Src: 67.205.74.184, Dst: 10.0.75.166
User Datagram Protocol, Src Port: 12760, Dst Port: 8000
Real-Time Transport Protocol

No.     Time           Source                Destination           Protocol Length Info
     58 259945234.692090 10.0.75.166           67.205.74.184         RTP      214    PT=ITU-T G.711 PCMU, SSRC=0xB76FC6F8, Seq=44559, Time=3029966843

Frame 58: 214 bytes on wire (1712 bits), 214 bytes captured (1712 bits)
Ethernet II, Src: ASUSTekC_d0:55:d4 (14:da:e9:d0:55:d4), Dst: Dell_f7:b1:d2 (00:19:b9:f7:b1:d2)
Internet Protocol Version 4, Src: 10.0.75.166, Dst: 67.205.74.184
User Datagram Protocol, Src Port: 8000, Dst Port: 12760
Real-Time Transport Protocol

No.     Time           Source                Destination           Protocol Length Info
     59 259945234.704847 10.0.75.166           67.205.74.184         RTP      214    PT=ITU-T G.711 PCMU, SSRC=0xB76FC6F8, Seq=44560, Time=3029967003

Frame 59: 214 bytes on wire (1712 bits), 214 bytes captured (1712 bits)
Ethernet II, Src: ASUSTekC_d0:55:d4 (14:da:e9:d0:55:d4), Dst: Dell_f7:b1:d2 (00:19:b9:f7:b1:d2)
Internet Protocol Version 4, Src: 10.0.75.166, Dst: 67.205.74.184
User Datagram Protocol, Src Port: 8000, Dst Port: 12760
Real-Time Transport Protocol

No.     Time           Source                Destination           Protocol Length Info
     60 259945234.705569 67.205.74.184         10.0.75.166           RTP      214    PT=ITU-T G.711 PCMU, SSRC=0x389B1E59, Seq=27421, Time=3207838928

Frame 60: 214 bytes on wire (1712 bits), 214 bytes captured (1712 bits)
Ethernet II, Src: Dell_f7:b1:d2 (00:19:b9:f7:b1:d2), Dst: ASUSTekC_d0:55:d4 (14:da:e9:d0:55:d4)
Internet Protocol Version 4, Src: 67.205.74.184, Dst: 10.0.75.166
User Datagram Protocol, Src Port: 12760, Dst Port: 8000
Real-Time Transport Protocol

No.     Time           Source                Destination           Protocol Length Info
     61 259945234.725325 67.205.74.184         10.0.75.166           RTP      214    PT=ITU-T G.711 PCMU, SSRC=0x389B1E59, Seq=27422, Time=3207839088

Frame 61: 214 bytes on wire (1712 bits), 214 bytes captured (1712 bits)
Ethernet II, Src: Dell_f7:b1:d2 (00:19:b9:f7:b1:d2), Dst: ASUSTekC_d0:55:d4 (14:da:e9:d0:55:d4)
Internet Protocol Version 4, Src: 67.205.74.184, Dst: 10.0.75.166
User Datagram Protocol, Src Port: 12760, Dst Port: 8000
Real-Time Transport Protocol

No.     Time           Source                Destination           Protocol Length Info
     62 259945234.727179 10.0.75.166           67.205.74.184         RTP      214    PT=ITU-T G.711 PCMU, SSRC=0xB76FC6F8, Seq=44561, Time=3029967163

Frame 62: 214 bytes on wire (1712 bits), 214 bytes captured (1712 bits)
Ethernet II, Src: ASUSTekC_d0:55:d4 (14:da:e9:d0:55:d4), Dst: Dell_f7:b1:d2 (00:19:b9:f7:b1:d2)
Internet Protocol Version 4, Src: 10.0.75.166, Dst: 67.205.74.184
User Datagram Protocol, Src Port: 8000, Dst Port: 12760
Real-Time Transport Protocol

